"150859","Brad Pitt","9","9","1","1","7.2","7, 5, 7, 8, 9, 7, 7, 7, 8","Ad Astra, World War Z, Moneyball, The Assassination Of Jesse James By The Coward Robert Ford, Sleepers, Spy Game, Killing Them Softly, Burn After Reading, The Curious Case Of Benjamin Button"
"150860","Philip Seymour Hoffman","9","8","2","2","7.0","5, 5, 8, 8, 7, 8, 7, 7, 8","The Hunger Games: Mockingjay Part I, The Hunger Games: Mockingjay Part Ii, The Ides Of March, The Big Lebowski, Moneyball, Magnolia, 25Th Hour, The Master, The Talented Mr. Ripley"
"150861","Matt Damon","8","6","3","9","7.5","7, 7, 7, 9, 9, 6, 7, 8","The Informant!, True Grit, The Rainmaker, The Departed, Ford V Ferrari, Contagion, The Bourne Identity, The Talented Mr. Ripley"
"150862","Oscar Isaac","8","6","4","10","7.5","8, 8, 8, 9, 6, 7, 7, 7","Ex Machina, Drive, The Card Counter, Dune, The Two Faces Of January, Inside Llewyn Davis, A Most Violent Year, Body Of Lies"
"150863","Woody Harrelson","8","8","5","3","6.6","7, 5, 5, 8, 8, 9, 5, 6","The Hunger Games: Catching Fire, The Hunger Games: Mockingjay Part I, The Hunger Games: Mockingjay Part Ii, No Country For Old Men, Seven Pounds, Three Billboards Outside Ebbing Missouri, The Highwaymen, Austin Powers: The Spy Who Shagged Me"
"150864","Robert De Niro","7","7","6","4","7.7","8, 8, 6, 7, 9, 7, 9","The Irishman, Heat, 15 Minutes, The Untouchables, Sleepers, Taxi Driver, The Godfather Part 2"
"150865","Christoph Waltz","7","6","7","8","7.7","7, 8, 9, 9, 7, 7, 7","Big Eyes, Water For Elephants, Alita: Battle Angel, Django Unchained, No Time To Die, The French Dispatch, Qt8 The First Eight"
"150866","Julianne Moore","7","6","8","13","7.1","5, 5, 8, 8, 7, 8, 9","The Hunger Games: Mockingjay Part I, The Hunger Games: Mockingjay Part Ii, The Big Lebowski, Kingsman: The Golden Circle, Non-Stop, Magnolia, Children Of Men"
"150867","Josh Brolin","7","7","9","5","7.0","7, 7, 8, 6, 6, 6, 9","True Grit, Sicario, No Country For Old Men, Sicario Day Of The Soldado, Everest, Oldboy (Us), Dune"
"150868","Barry Pepper","7","7","10","6","6.9","7, 8, 7, 8, 6, 7, 5","True Grit, Seven Pounds, Crawl, The Green Mile, Maze Runner: The Scorch Trials, 25Th Hour, Maze Runner: The Death Cure"
"150869","Jeffrey Wright","7","6","11","14","6.7","5, 5, 8, 7, 7, 7, 8","The Hunger Games: Mockingjay Part I, The Hunger Games: Mockingjay Part Ii, The Ides Of March, The Laundromat , No Time To Die, The French Dispatch, The Batman"
"150870","Samuel L. Jackson","7","6","12","15","6.7","6, 7, 9, 5, 6, 7, 7","The Other Guys, Death To 2020, Django Unchained, Spiral, Oldboy (Us), A Time To Kill, Qt8 The First Eight"
"150871","Al Pacino","6","6","13","7","8.3","8, 8, 9, 9, 8, 8","The Irishman, Heat, The Godfather, The Godfather Part 2, The Godfather Part 3, Devil’S Advocate"
"150872","Chris Evans","6","5","14","16","8.0","8, 9, 6, 8, 9, 8","Knives Out, Snowpiercer, The Red Sea Diving Resort, Scott Pilgrim Vs The World, Sunshine, The Gray Man"
"150873","Ryan Gosling","6","5","15","17","8.0","8, 9, 7, 8, 8, 8","Fracture, La La Land, Nice Guys, The Ides Of March, Drive, The Gray Man"
"150874","Leonardo DiCaprio","6","5","16","18","7.8","6, 8, 9, 9, 8, 7","The Revolutionary Road, Blood Diamond, The Departed, Django Unchained, Don’T Look Up, Body Of Lies"
"150875","Jon Bernthal","6","5","17","20","7.5","7, 7, 9, 7, 7, 8","Sicario, The Peanut Butter Falcon, Ford V Ferrari, Baby Driver, The Unforgivable, King Richard"
"150876","Tilda Swinton","6","6","18","11","7.2","9, 6, 6, 7, 8, 7","Snowpiercer, Okja, The Personal History Of David Copperfield, Burn After Reading, The Curious Case Of Benjamin Button, The French Dispatch"
"150877","Frances McDormand","6","6","19","12","7.2","8, 6, 9, 7, 6, 7","Primal Fear, Nomadland, Three Billboards Outside Ebbing Missouri, Burn After Reading, Fargo, The French Dispatch"
"150878","Richard Jenkins","6","5","20","28","6.7","7, 7, 7, 7, 6, 6","Shape Of Water, The Cabin In The Woods, Killing Them Softly, Burn After Reading, Kajillionaire, Nightmare Alley"
"150879","Mark Strong","5","4","21","35","8.0","8, 8, 8, 9, 7","Sherlock Holmes, Rocknrolla, Kingsman: The Golden Circle, Sunshine, Body Of Lies"
"150880","Bryan Cranston","5","5","22","19","7.8","7, 9, 8, 7, 8","Trumbo, Last Flag Flying, Argo, The Upside, Drive"
"150881","Jude Law","5","4","23","41","7.6","8, 7, 9, 6, 8","Sherlock Holmes, Sherlock Holmes: A Game Of Shadows, King Arthur: Legend Of The Sword, Contagion, The Talented Mr. Ripley"
"150882","Eddie Marsan","5","5","24","21","7.4","8, 8, 7, 7, 7","The Gentlemen, Sherlock Holmes, Sherlock Holmes: A Game Of Shadows, The Illusionist, Wrath Of Man"
"150883","Kang-ho Song","5","5","25","22","7.4","9, 8, 5, 8, 7","Snowpiercer, Parasite, The Host, Memories Of Murder, Sympathy For Mr. Vengeance"
"150884","Cate Blanchett","5","3","26","104","7.4","8, 8, 7, 6, 8","The Curious Case Of Benjamin Button, Don’T Look Up, Ocean’S 8, Nightmare Alley, The Talented Mr. Ripley"
"150885","Daniel Craig","5","5","27","23","6.8","8, 7, 6, 6, 7","Knives Out, Capote, Dream House, The Jacket, No Time To Die"
"150886","Mahershala Ali","5","5","28","24","6.8","7, 5, 5, 9, 8","Green Book, The Hunger Games: Mockingjay Part I, The Hunger Games: Mockingjay Part Ii, Alita: Battle Angel, The Curious Case Of Benjamin Button"
"150887","Adam Driver","5","5","29","25","6.8","8, 6, 5, 8, 7","Marriage Story, Blackkklansman, Paterson, The Report, Inside Llewyn Davis"
"150888","Jon Hamm","5","5","30","26","6.8","7, 8, 6, 7, 6","The Town, The Report, Top Gun, Baby Driver, No Sudden Move"
"150889","Patricia Clarkson","5","5","31","27","6.8","8, 7, 8, 6, 5","The Maze Runner, The Untouchables, The Green Mile, Maze Runner: The Scorch Trials, Maze Runner: The Death Cure"
"150890","Lily James","5","5","32","29","6.6","7, 8, 6, 5, 7","Darkest Hour, Yesterday, Rebecca, Sorry To Bother You, Baby Driver"
"150891","Jennifer Lawrence","5","5","33","30","6.4","7, 5, 5, 7, 8","The Hunger Games: Catching Fire, The Hunger Games: Mockingjay Part I, The Hunger Games: Mockingjay Part Ii, American Hustle, Don’T Look Up"
"150892","Donald Sutherland","5","5","34","31","6.2","7, 7, 5, 5, 7","Ad Astra, The Hunger Games: Catching Fire, The Hunger Games: Mockingjay Part I, The Hunger Games: Mockingjay Part Ii, A Time To Kill"
"150893","Naomi Watts","5","5","35","32","6.2","6, 6, 7, 5, 7","Dream House, The International, Luce, Penguin Bloom, Fair Game"
"150894","Stanley Tucci","5","5","36","33","6.0","7, 7, 5, 5, 6","Spotlight, The Hunger Games: Catching Fire, The Hunger Games: Mockingjay Part I, The Hunger Games: Mockingjay Part Ii, The King’S Man"
"150895","Diane Keaton","4","4","37","34","8.2","7, 9, 9, 8","Book Club, The Godfather, The Godfather Part 2, The Godfather Part 3"
"150896","J.K. Simmons","4","4","38","36","8.0","9, 8, 7, 8","La La Land, Palm Springs, Burn After Reading, 21 Bridges"
"150897","Sam Rockwell","4","4","39","37","8.0","7, 8, 8, 9","Jojo Rabbit, The Assassination Of Jesse James By The Coward Robert Ford, The Green Mile, Three Billboards Outside Ebbing Missouri"
"150898","Melanie Lynskey","4","4","40","38","7.8","7, 7, 9, 8","The Informant!, Away We Go, The Perks Of Being A Wallflower, Don’T Look Up"
"150899","Ana de Armas","4","3","41","85","7.8","8, 8, 7, 8","Knives Out, War Dogs, No Time To Die, The Gray Man"
"150900","Jeremy Renner","4","4","42","39","7.8","7, 8, 7, 9","The Town, The Assassination Of Jesse James By The Coward Robert Ford, American Hustle, Arrival"
"150901","Eiza González","4","4","43","40","7.8","9, 7, 8, 7","Alita: Battle Angel, Baby Driver, I Care A Lot, Godzilla Vs Kong"
"150902","Cliff Curtis","4","4","44","42","7.5","8, 8, 5, 9","Fracture, Doctor Sleep, The Meg, Sunshine"
"150903","Michael Stuhlbarg","4","4","45","43","7.5","7, 7, 7, 9","Shape Of Water, Trumbo, Steve Jobs, Arrival"
"150904","Liev Schreiber","4","3","46","103","7.5","7, 8, 7, 8","Spotlight, Scream (1996), Scream 2, King Richard"
"150905","Helena Bonham Carter","4","4","47","44","7.5","8, 9, 6, 7","KingS Speech, Big Fish, Enola Holmes, Ocean’S 8"
"150906","Amy Adams","4","4","48","45","7.5","7, 7, 9, 7","Big Eyes, American Hustle, Arrival, The Master"
"150907","Clive Owen","4","2","49","335","7.2","7, 6, 7, 9","Inside Man, The International, The Bourne Identity, Children Of Men"
"150908","Ed Harris","4","4","50","46","7.2","9, 6, 6, 8","Snowpiercer, Run All Night, Top Gun, The Lost Daughter"
"150909","Rachel McAdams","4","4","51","47","7.2","8, 7, 7, 7","Sherlock Holmes, Spotlight, State Of Play, Sherlock Holmes: A Game Of Shadows"
"150910","Russell Crowe","4","3","52","123","7.2","7, 7, 8, 7","Nice Guys, State Of Play, L.A. Confidential, Body Of Lies"
"150911","Djimon Hounsou","4","4","53","48","7.2","8, 9, 6, 6","Blood Diamond, King Arthur: Legend Of The Sword, A Quiet Place Part 2, The King’S Man"
"150912","Jamie Foxx","4","3","54","124","7.2","6, 7, 9, 7","Just Mercy, Baby Driver, Django Unchained, Qt8 The First Eight"
"150913","Ben Affleck","4","4","55","49","7.2","7, 7, 7, 8","State Of Play, The Town, The Way Back, Argo"
"150914","Jason Bayle","4","4","56","50","7.2","7, 7, 8, 7","Trumbo, Happy Death Day 2U, Our Friend, Happy Death Day"
"150915","Tate Donovan","4","4","57","51","7.2","7, 8, 7, 7","Rocketman, Argo, The Upside, Manchester By The Sea"
"150916","Carey Mulligan","4","4","58","52","7.2","7, 7, 8, 7","Mudbound, Promising Young Woman, Drive, Inside Llewyn Davis"
"150917","Mark Rylance","4","4","59","53","7.2","7, 7, 8, 7","Ready Player One, Dunkirk, Don’T Look Up, The Trial Of Chicago 7"
"150918","Casey Affleck","4","4","60","54","7.2","6, 8, 7, 8","The Old Man & The Gun, The Assassination Of Jesse James By The Coward Robert Ford, Manchester By The Sea, Our Friend"
"150919","Jesse Plemons","4","4","61","55","7.0","8, 7, 6, 7","The Irishman, The Master, The Power Of The Dog, Windfall"
"150920","David Strathairn","4","3","62","127","7.0","8, 8, 6, 6","Fracture, L.A. Confidential, Nomadland, Nightmare Alley"
"150921","Hugh Grant","4","4","63","56","7.0","8, 7, 7, 6","The Gentlemen, The Man From U.N.C.L.E., Death To 2020, Death To 2021"
"150922","Cillian Murphy","4","4","64","57","7.0","6, 6, 7, 9","Anna, A Quiet Place Part 2, Dunkirk, Sunshine"
"150923","Sandra Bullock","4","4","65","58","7.0","7, 7, 7, 7","Capote, The Unforgivable, A Time To Kill, Ocean’S 8"
"150924","Jeff Daniels","4","4","66","59","7.0","7, 7, 7, 7","Capote, State Of Play, Steve Jobs, Away We Go"
"150925","Kevin Costner","4","4","67","60","7.0","9, 7, 7, 5","Molly’S Game, Mr. Brooks, The Untouchables, The Highwaymen"
"150926","Bradley Cooper","4","3","68","142","7.0","7, 7, 8, 6","A Star Is Born, American Hustle, War Dogs, Nightmare Alley"
"150927","Laurence Fishburne","4","4","69","61","7.0","9, 7, 6, 6","Last Flag Flying, Death To 2020, Contagion, Apocalypse Now"
"150928","Michael Keaton","4","4","70","62","6.8","7, 6, 7, 7","Spotlight, The Other Guys, The Founder, The Trial Of Chicago 7"
"150929","Alec Baldwin","4","4","71","63","6.8","6, 5, 7, 9","Blackkklansman, Motherless Brooklyn, A Star Is Born, The Departed"
"150930","Robert Pattinson","4","3","72","148","6.8","6, 8, 5, 8","The Devil All The Time, Water For Elephants, Tenet, The Batman"
"150931","Alessandro Nivola","4","3","73","149","6.8","6, 7, 7, 7","The Red Sea Diving Resort, American Hustle, The Art Of Self-Defense, A Most Violent Year"
"150932","Jaeden Martell","4","4","74","64","6.5","8, 6, 7, 5","Knives Out, The Lodge, It, It Chapter 2"
"150933","Willem Dafoe","4","3","75","169","6.5","7, 5, 8, 6","Inside Man, Motherless Brooklyn, The Card Counter, Nightmare Alley"
"150934","Benicio Del Toro","4","4","76","65","6.5","7, 6, 6, 7","Sicario, Sicario Day Of The Soldado, No Sudden Move, The French Dispatch"
"150935","Robin Wright","4","4","77","66","6.5","7, 7, 6, 6","State Of Play, Moneyball, Everest, Wonder Woman 1984"
"150936","Kaya Scodelario","4","4","78","67","6.5","8, 7, 6, 5","The Maze Runner, Crawl, Maze Runner: The Scorch Trials, Maze Runner: The Death Cure"
"150937","Miles Teller","4","3","79","170","6.5","6, 6, 8, 6","Project X, Top Gun, War Dogs, Spiderhead"
"150938","Jake Gyllenhaal","4","4","80","68","6.2","7, 6, 6, 6","Prisoners, Okja, Everest, The Guilty"
"150939","Armie Hammer","4","4","81","69","6.2","7, 6, 5, 7","The Man From U.N.C.L.E., Rebecca, Sorry To Bother You, Death On The Nile"
"150940","Keira Knightley","4","3","82","186","6.2","7, 6, 6, 6","Atonement, The Jacket, Everest, Silent Night"
"150941","John Carroll Lynch","4","4","83","70","6.2","7, 5, 6, 7","The Founder, The Highwaymen, Fargo, The Trial Of Chicago 7"
"150942","LaKeith Stanfield","4","4","84","71","6.0","8, 6, 5, 5","Knives Out, Uncut Gems, Sorry To Bother You, The Purge: Anarchy"
"150943","Liam Hemsworth","4","4","85","72","6.0","7, 5, 5, 7","The Hunger Games: Catching Fire, The Hunger Games: Mockingjay Part I, The Hunger Games: Mockingjay Part Ii, Triangle"
"150944","Charlie Hunnam","3","2","86","207","8.7","8, 9, 9","The Gentlemen, King Arthur: Legend Of The Sword, Children Of Men"
"150945","Ewan McGregor","3","3","87","73","8.7","8, 9, 9","Doctor Sleep, Big Fish, Moulin Rouge"
"150946","Talia Shire","3","3","88","74","8.7","9, 9, 8","The Godfather, The Godfather Part 2, The Godfather Part 3"
"150947","Richard Bright","3","3","89","75","8.7","9, 9, 8","The Godfather, The Godfather Part 2, The Godfather Part 3"
"150948","Billy Crudup","3","3","90","76","8.3","7, 9, 9","Spotlight, Big Fish, Sleepers"
"150949","Don Johnson","3","3","91","77","8.0","8, 7, 9","Knives Out, Book Club, Django Unchained"
"150950","Anthony Hopkins","3","3","92","78","8.0","8, 8, 8","Fracture, The Two Popes, The Father"
"150951","Jeremy Strong","3","3","93","79","8.0","8, 9, 7","The Gentlemen, Molly’S Game, The Trial Of Chicago 7"
"150952","Himesh Patel","3","3","94","80","8.0","8, 8, 8","Yesterday, The Aeronauts, Don’T Look Up"
"150953","Colin Firth","3","3","95","81","8.0","8, 8, 8","1917, KingS Speech, Kingsman: The Golden Circle"
"150954","Javier Bardem","3","3","96","82","8.0","7, 8, 9","Sea Inside, No Country For Old Men, Dune"
"150955","Eric Bana","3","2","97","240","8.0","7, 9, 8","The Dry, King Arthur: Legend Of The Sword, Chopper"
"150956","Robert Duvall","3","3","98","83","8.0","9, 6, 9","The Godfather, Apocalypse Now, The Godfather Part 2"
"150957","Timothée Chalamet","3","3","99","84","8.0","8, 7, 9","Don’T Look Up, The French Dispatch, Dune"
"150958","Jeffrey DeMunn","3","3","100","86","7.7","8, 8, 7","Shawshank Redemption, The Green Mile, Burn After Reading"
"150959","Chiwetel Ejiofor","3","2","101","248","7.7","7, 7, 9","Inside Man, Secret In Their Eyes, Children Of Men"
"150960","Octavia Spencer","3","3","102","87","7.7","9, 7, 7","Snowpiercer, Shape Of Water, Luce"
"150961","Tommy Lee Jones","3","3","103","88","7.7","7, 8, 8","Ad Astra, Double Jeopardy, No Country For Old Men"
"150962","Jeff Bridges","3","3","104","89","7.7","7, 8, 8","True Grit, The Big Lebowski, Kingsman: The Golden Circle"
"150963","Victor Garber","3","3","105","90","7.7","8, 7, 8","Dark Waters, Sicario, Argo"
"150964","Idris Elba","3","3","106","91","7.7","6, 8, 9","The Dark Tower, Rocknrolla, Molly’S Game"
"150965","Jessica Rothe","3","3","107","92","7.7","9, 7, 7","La La Land, Happy Death Day 2U, Happy Death Day"
"150966","Nicole Kidman","3","3","108","93","7.7","7, 9, 7","Secret In Their Eyes, Moulin Rouge, The Upside"
"150967","Jennifer Connelly","3","3","109","94","7.7","8, 9, 6","Blood Diamond, Alita: Battle Angel, Top Gun"
"150968","Ashley Judd","3","3","110","95","7.7","8, 8, 7","Heat, Double Jeopardy, A Time To Kill"
"150969","John Goodman","3","3","111","96","7.7","8, 8, 7","The Big Lebowski, Argo, Inside Llewyn Davis"
"150970","Steve Buscemi","3","3","112","97","7.7","8, 9, 6","The Big Lebowski, Big Fish, Fargo"
"150971","Dakota Johnson","3","3","113","98","7.7","7, 8, 8","The Peanut Butter Falcon, Our Friend, The Lost Daughter"
"150972","Bruce Dern","3","2","114","249","7.7","7, 9, 7","The Peanut Butter Falcon, Django Unchained, Qt8 The First Eight"
"150973","Paul Schneider","3","3","115","99","7.7","8, 8, 7","Water For Elephants, The Assassination Of Jesse James By The Coward Robert Ford, Away We Go"
"150974","Chris Messina","3","3","116","100","7.7","8, 7, 8","Argo, Away We Go, I Care A Lot"
"150975","Jonah Hill","3","3","117","101","7.7","7, 8, 8","Moneyball, War Dogs, Don’T Look Up"
"150976","Choi Min-sik","3","3","118","102","7.7","8, 7, 8","Oldboy, Lady Vengeance, I Saw The Devil"
"150977","Tim Robbins","3","3","119","105","7.3","8, 8, 6","Shawshank Redemption, Dark Waters, Austin Powers: The Spy Who Shagged Me"
"150978","Michael Shannon","3","3","120","106","7.3","8, 7, 7","Knives Out, Shape Of Water, 8 Mile"
"150979","Steve Park","3","3","121","107","7.3","9, 6, 7","Snowpiercer, Fargo, The French Dispatch"
"150980","Mark Ruffalo","3","3","122","108","7.3","7, 8, 7","Spotlight, Dark Waters, Eternal Sunshine Of The Spotless Mind"
"150981","Jason Schwartzman","3","3","123","109","7.3","7, 8, 7","Big Eyes, Scott Pilgrim Vs The World, The French Dispatch"
"150982","Kim Basinger","3","3","124","110","7.3","7, 7, 8","Nice Guys, 8 Mile, L.A. Confidential"
"150983","Bo Burnham","3","3","125","111","7.3","7, 7, 8","The Big Sick, Promising Young Woman, Bo Burnham Inside"
"150984","Jared Harris","3","3","126","112","7.3","7, 7, 8","Sherlock Holmes: A Game Of Shadows, The Man From U.N.C.L.E., The Curious Case Of Benjamin Button"
"150985","Rob Morgan","3","3","127","113","7.3","7, 7, 8","Mudbound, The Unforgivable, Don’T Look Up"
"150986","Kevin Spacey","3","3","128","114","7.3","8, 7, 7","L.A. Confidential, Baby Driver, A Time To Kill"
"150987","Andy Garcia","3","3","129","115","7.3","7, 7, 8","The Untouchables, Book Club, The Godfather Part 3"
"150988","Scoot McNairy","3","3","130","116","7.3","8, 7, 7","Argo, Killing Them Softly, Non-Stop"
"150989","Kyle Chandler","3","3","131","117","7.3","8, 7, 7","Argo, Manchester By The Sea, Godzilla Vs Kong"
"150990","Yahya Abdul-Mateen II","3","3","132","118","7.3","9, 7, 6","Us, The Trial Of Chicago 7, The Matrix Resurrections "
"150991","Sam Shepard","3","3","133","119","7.3","8, 7, 7","The Assassination Of Jesse James By The Coward Robert Ford, Killing Them Softly, Fair Game"
"150992","Albert Brooks","3","2","134","332","7.3","7, 8, 7","Taxi Driver, Drive, A Most Violent Year"
"150993","Peter Sarsgaard","3","2","135","333","7.3","6, 8, 8","The Guilty, The Lost Daughter, The Batman"
"150994","Ron Perlman","3","2","136","334","7.3","8, 8, 6","Drive, Don’T Look Up, Nightmare Alley"
"150995","Neve Campbell","3","3","137","120","7.3","7, 8, 7","Scream (2022), Scream (1996), Scream 2"
"150996","Courteney Cox","3","3","138","121","7.3","7, 8, 7","Scream (2022), Scream (1996), Scream 2"
"150997","David Arquette","3","3","139","122","7.3","7, 8, 7","Scream (2022), Scream (1996), Scream 2"
"150998","Ben Mendelsohn","3","3","140","125","7.0","7, 7, 7","Darkest Hour, Ready Player One, Killing Them Softly"
"150999","Christopher Plummer","3","3","141","126","7.0","8, 7, 6","Knives Out, Inside Man, All The Money In The World"
"151000","Matthew McConaughey","3","3","142","128","7.0","8, 6, 7","The Gentlemen, The Dark Tower, A Time To Kill"
"151001","Denzel Washington","3","3","143","129","7.0","7, 8, 6","Inside Man, Man On Fire, The Little Things"
"151002","Jodie Foster","3","3","144","130","7.0","7, 7, 7","Inside Man, The Mauritanian, Taxi Driver"
"151003","John Ortiz","3","3","145","131","7.0","7, 7, 7","Ad Astra, A Dog’S Purpose, Steve Jobs"
"151004","Robert Downey Jr.","3","3","146","132","7.0","8, 7, 6","Sherlock Holmes, Sherlock Holmes: A Game Of Shadows, Kiss Kiss Bang Bang"
"151005","Gwyneth Paltrow","3","2","147","353","7.0","7, 6, 8","Capote, Contagion, The Talented Mr. Ripley"
"151006","Logan Miller","3","3","148","133","7.0","7, 7, 7","A Dog’S Purpose, Escape Room, Escape Room: Tournament Of Champions"
"151007","Lois Smith","3","3","149","134","7.0","7, 6, 8","Nice Guys, Run All Night, Uncle Frank"
"151008","Isiah Whitlock Jr.","3","3","150","135","7.0","6, 7, 8","Blackkklansman, 25Th Hour, I Care A Lot"
"151009","Jessica Chastain","3","2","151","356","7.0","9, 5, 7","Molly’S Game, It Chapter 2, A Most Violent Year"
"151010","Viola Davis","3","3","152","136","7.0","7, 7, 7","State Of Play, Prisoners, The Unforgivable"
"151011","Mark Wahlberg","3","3","153","137","7.0","6, 6, 9","The Other Guys, All The Money In The World, The Departed"
"151012","Thomasin McKenzie","3","3","154","138","7.0","7, 6, 8","Jojo Rabbit, The Power Of The Dog, Last Night In Soho"
"151013","Taika Waititi","3","3","155","139","7.0","7, 8, 6","Jojo Rabbit, Hunt For The Wilderpeople, Free Guy"
"151014","Dylan Minnette","3","3","156","140","7.0","7, 7, 7","Don’T Breathe, Prisoners, Scream (2022)"
"151015","Chris Cooper","3","2","157","364","7.0","7, 7, 7","The Town, A Time To Kill, The Bourne Identity"
"151016","Paul Dano","3","2","158","365","7.0","7, 6, 8","Prisoners, The Guilty, The Batman"
"151017","Steven Mackintosh","3","3","159","141","7.0","7, 8, 6","Rocketman, Lock Stock And Two Smoking Barrels, The Jacket"
"151018","Cristin Milioti","3","3","160","143","7.0","8, 7, 6","Palm Springs, Death To 2020, Death To 2021"
"151019","Sarah Snook","3","3","161","144","7.0","6, 8, 7","Pieces Of A Woman, Predestination, Steve Jobs"
"151020","Noah Jupe","3","3","162","145","7.0","9, 6, 6","Ford V Ferrari, A Quiet Place Part 2, No Sudden Move"
"151021","Connie Nielsen","3","3","163","146","7.0","7, 6, 8","Nobody, Wonder Woman 1984, Devil’S Advocate"
"151022","Mary Steenburgen","3","2","164","399","7.0","7, 8, 6","Book Club, Back To The Future, Nightmare Alley"
"151023","Walton Goggins","3","2","165","403","7.0","9, 5, 7","Django Unchained, Maze Runner: The Death Cure, The Bourne Identity"
"151024","Josh Hamilton","3","2","166","406","7.0","7, 7, 7","Away We Go, Manchester By The Sea, The Bourne Identity"
"151025","Helen Mirren","3","3","167","147","6.8","6, 7, 7, 7","Anna, State Of Play, Trumbo, The Duke"
"151026","Toni Collette","3","2","168","412","6.7","8, 6, 6","Knives Out, Stowaway, Nightmare Alley"
"151027","Kate Winslet","3","3","169","150","6.7","6, 7, 7","The Revolutionary Road, Eternal Sunshine Of The Spotless Mind, Steve Jobs"
"151028","Jeffrey Donovan","3","3","170","151","6.7","7, 6, 7","Sicario, Sicario Day Of The Soldado, Wrath Of Man"
"151029","Michael Kelly","3","3","171","152","6.7","7, 6, 7","Secret In Their Eyes, Everest, Fair Game"
"151030","Edward Norton","3","3","172","153","6.7","8, 5, 7","Primal Fear, Motherless Brooklyn, The Illusionist"
"151031","Val Kilmer","3","3","173","154","6.7","8, 6, 6","Heat, Kiss Kiss Bang Bang, Top Gun"
"151032","Charlize Theron","3","3","174","155","6.7","6, 6, 8","Long Shot, 15 Minutes, Devil’S Advocate"
"151033","Jason Statham","3","3","175","156","6.7","8, 5, 7","Lock Stock And Two Smoking Barrels, The Meg, Wrath Of Man"
"151034","Benedict Cumberbatch","3","3","176","157","6.7","7, 7, 6","Atonement, The Courier, The Power Of The Dog"
"151035","Shea Whigham","3","3","177","158","6.7","6, 7, 7","Sicario Day Of The Soldado, American Hustle, Non-Stop"
"151036","Noah Robbins","3","3","178","159","6.7","6, 7, 7","The Assistant, The Trial Of Chicago 7, Tick Tick… Boom!"
"151037","Ethan Hawke","3","3","179","160","6.7","6, 8, 6","The Purge, Predestination, The Guilty"
"151038","Aidan Gillen","3","3","180","161","6.7","9, 6, 5","King Arthur: Legend Of The Sword, Maze Runner: The Scorch Trials, Maze Runner: The Death Cure"
"151039","Rosa Salazar","3","3","181","162","6.7","6, 9, 5","Maze Runner: The Scorch Trials, Alita: Battle Angel, Maze Runner: The Death Cure"
"151040","Imogen Poots","3","3","182","163","6.7","8, 5, 7","The Father, Vivarium, The Art Of Self-Defense"
"151041","Mads Mikkelsen","3","3","183","164","6.7","8, 7, 5","Another Round, The Hunt, Polar"
"151042","Mathieu Amalric","3","3","184","165","6.7","6, 7, 7","The Sound Of Metal, Oxygen, The French Dispatch"
"151043","Max Casella","3","3","185","166","6.7","7, 6, 7","Killing Them Softly, Oldboy (Us), Inside Llewyn Davis"
"151044","Pedro Pascal","3","2","186","413","6.7","8, 6, 6","Kingsman: The Golden Circle, Wonder Woman 1984, The Unbearable Weight Of Massive Talent"
"151045","W. Earl Brown","3","3","187","167","6.7","5, 7, 8","The Highwaymen, The Unforgivable, Scream (1996)"
"151046","Sophia Lillis","3","3","188","168","6.7","8, 7, 5","Uncle Frank, It, It Chapter 2"
"151047","David Harbour","3","3","189","171","6.3","6, 7, 6","The Revolutionary Road, State Of Play, No Sudden Move"
"151048","William Jackson Harper","3","3","190","172","6.3","8, 5, 6","Dark Waters, Paterson, Death To 2021"
"151049","Kirsten Dunst","3","3","191","173","6.3","7, 6, 6","Eternal Sunshine Of The Spotless Mind, The Power Of The Dog, The Two Faces Of January"
"151050","Barry Shabaka Henley","3","3","192","174","6.3","7, 5, 7","State Of Play, Paterson, A Star Is Born"
"151051","Will Ferrell","3","3","193","175","6.3","6, 7, 6","The Other Guys, Austin Powers: International Man Of Mystery, Austin Powers: The Spy Who Shagged Me"
"151052","Chris Hemsworth","3","2","194","486","6.3","6, 7, 6","Extraction, The Cabin In The Woods, Spiderhead"
"151053","Golshifteh Farahani","3","2","195","487","6.3","5, 7, 7","Paterson, The Upside, Body Of Lies"
"151054","Liam Neeson","3","3","196","176","6.3","6, 6, 7","Unknown, Run All Night, Non-Stop"
"151055","Jason Clarke","3","3","197","177","6.3","7, 6, 6","Mudbound, The Devil All The Time, Everest"
"151056","Bruce Willis","3","3","198","178","6.3","5, 8, 6","Motherless Brooklyn, Die Hard, Die Hard 2"
"151057","Byun Hee-Bong","3","3","199","179","6.3","6, 5, 8","Okja, The Host, Memories Of Murder"
"151058","Dylan OBrien","3","3","200","180","6.3","8, 6, 5","The Maze Runner, Maze Runner: The Scorch Trials, Maze Runner: The Death Cure"
"151059","Thomas Brodie-Sangster","3","3","201","181","6.3","8, 6, 5","The Maze Runner, Maze Runner: The Scorch Trials, Maze Runner: The Death Cure"
